{
  "schema_version": 1,
  "generated_at": "2026-09-27",
  "source": {
    "publisher": "Province of Manitoba — Residential Tenancies Branch",
    "index_url": "https://www.gov.mb.ca/cca/rtb/landlord/forms.html",
    "snapshot_sha256": "49f27e6d6b688ed7e8cd695d12ad40e4a06b3af28df6ff8f9866608ff200014e"
  },
  "dataset": {
    "id": "mb-rtb-forms-catalog",
    "jurisdiction": "Manitoba, Canada",
    "authority": "Residential Tenancies Branch",
    "id_pattern": "^(P9-)?[0-9]{1,2}(\\.[0-9])?[A-Z]?$|^(HABLATE|SUBSVC|CORRECT-ORDER|MIL-CERT|DEPOSIT-INFO)$",
    "last_verified": "2026-09-26",
    "official_forms_index_url": "https://www.gov.mb.ca/cca/rtb/landlord/forms.html",
    "official_forms_numbered_url": "https://www.gov.mb.ca/cca/rtb/landlord/forms.html",
    "notes": [
      "Use the current official form version. Form versions and URLs may change.",
      "Two schedules to the Residential Tenancies Regulation each number their own forms: Parts 1 to 8 (the general schedule) and Part 9 (the rent regulation schedule). Both schedules have a Form 2, 3, 4, 8 and 9, so a Part 9 form keeps a `P9-` prefix on its catalog id (for example `P9-2`); a Parts 1-8 form keeps the bare official number. A form number with a decimal (Form 1.1, Form 8.1) is stored with a hyphen instead of a dot (`1.1`, `8.1`) because a dot is not a valid catalog id character.",
      "The landlord forms page links more forms than the tenant forms page (https://www.gov.mb.ca/cca/rtb/tenant/forms.html) and is the page the updater reads. Three documents live only on the tenant page: Form 7 (Notice of Termination by Tenant, Parts 1-8 schedule), the Canadian Forces relocation certificate, and the Deposit Information Sheet. Their official_url still sits under the forms directory the updater manages, so it reports them as not linked from the index page rather than retiring them; this mirrors the BC catalog's handling of RTB-10, RTB-28 and RTB-44.",
      "A handful of documents carry no official form number (the habitually late letter, the substitutional service application, the request to correct or amend an order, the relocation certificate, the deposit information sheet); each is catalogued with a short uppercase slug id instead.",
      "The Residential Tenancies Branch is a provincial branch of the Consumer Protection Office, not a tribunal; most notices take effect on service and are not filed with the Branch unless disputed. The Branch's director issues orders and the Residential Tenancies Commission hears appeals.",
      "A property manager may prepare or serve a form as an authorized agent, but the legal party remains the landlord or tenant unless the form or law states otherwise.",
      "A form does not itself create authority to end a tenancy, increase rent, or reduce a service; the applicable sections of The Residential Tenancies Act (Manitoba) and its regulations control."
    ]
  },
  "enums": {
    "party_roles": [
      "landlord",
      "tenant",
      "property_manager_or_authorized_agent",
      "purchaser",
      "landlord_and_tenant",
      "applicant",
      "branch",
      "canadian_forces_official"
    ],
    "matter_types": [
      "agreement",
      "condition_inspection",
      "rent",
      "service_or_facility",
      "ending_tenancy",
      "abandoned_property",
      "landlord_change",
      "application",
      "service_of_documents",
      "review_or_correction"
    ],
    "availability": [
      "active",
      "specialized",
      "historical_or_replaced",
      "portal_generated",
      "not_a_landlord_tenant_form"
    ]
  },
  "operational_rules": {
    "landlord_vs_property_manager": {
      "landlord": "The owner or legal entity that is the landlord under the tenancy agreement. The landlord remains responsible for statutory obligations even when an agent performs administrative tasks.",
      "property_manager_or_authorized_agent": "A person or company authorized to act for the landlord. The manager may complete, sign, serve, receive, file, or respond to forms only within the authority granted by the landlord and the applicable form or process.",
      "tenant": "The person or persons named as tenant(s) under the tenancy agreement. A tenant signs tenant-originated forms and receives landlord notices.",
      "practical_rule": "Identify the legal landlord by their legal name in section 1 of the standard tenancy agreement. Keep written proof of any agent's authority to act for the landlord."
    },
    "document_controls": [
      "Record the form ID, version date, completion date, service date, serving person, recipient, service method, and proof of service.",
      "Use the official Branch form rather than reproducing a private form when the Act or its regulations require a prescribed form.",
      "Give the tenant a copy of the signed tenancy agreement within 21 days of signing, as Form 1 itself requires.",
      "Keep the signed agreement, the move-in and move-out condition reports (Form 5), any notice served, proof of service, and the rent ledger together for any later application to the Branch."
    ]
  },
  "source_records": [
    {
      "source_id": "web:mb-1",
      "title": "Landlord Forms - Residential Tenancies Branch",
      "url": "https://www.gov.mb.ca/cca/rtb/landlord/forms.html",
      "last_updated_as_found": "2026-09-26",
      "coverage": "Numbered notice, agreement and application forms for landlords under Parts 1 to 8 and Part 9 of the Residential Tenancies Regulation, plus unnumbered branch documents."
    },
    {
      "source_id": "web:mb-2",
      "title": "Tenant Forms - Residential Tenancies Branch",
      "url": "https://www.gov.mb.ca/cca/rtb/tenant/forms.html",
      "last_updated_as_found": "2026-09-26",
      "coverage": "The same forms directory from the tenant's side; the source of Form 7 (Notice of Termination by Tenant), the Canadian Forces relocation certificate, and the Deposit Information Sheet, none of which are linked from the landlord page."
    }
  ],
  "forms": [
    {
      "id": "1",
      "form_name": "Standard Residential Tenancy Agreement",
      "status": "active",
      "category": "agreements",
      "matter_type": "agreement",
      "current_version": null,
      "official_url": "https://www.gov.mb.ca/cca/rtb/forms/part1to8/form1.doc",
      "official_index_url": "https://www.gov.mb.ca/cca/rtb/landlord/forms.html",
      "initiating_party": "landlord",
      "parties": [
        "landlord",
        "tenant"
      ],
      "property_manager_role": "May be named as the contact for rent and notices, but the form calls for the landlord's own legal name, address and telephone number, and a landlord signature; the form does not provide for an agent to sign in the landlord's place.",
      "use_when": "Starting a residential tenancy in Manitoba that does not include tenant services and does not involve a mobile home or mobile home site.",
      "do_not_use_when": [
        "Tenancies that include tenant services (use Form 1.1).",
        "Tenancies of a mobile home, mobile home site, or both (use Form 2)."
      ],
      "related_forms": [
        "1.1",
        "2",
        "4",
        "5"
      ],
      "legal_effect": "Prescribed under The Residential Tenancies Act for all Manitoba residential tenancies other than tenancies that include tenant services or a mobile home/site; two copies must be signed and one given to the tenant within 21 days.",
      "source_basis": [
        "\"This form of Tenancy Agreement is prescribed under The Residential Tenancies Act (the Act) and applies to all residential tenancies in Manitoba, other than tenancies that include tenant services or tenancies respecting a mobile home, mobile home site, or both.\"",
        "\"Two copies must be signed by both landlord and tenant. One copy must be given to the tenant within 21 days after it is signed.\"",
        "Deposit clause on the form: \"maximum = 1/2 month's Rent Payable for security deposit, 1 month's Rent Payable for pet damage deposit.\"",
        "A fillable-looking rendition of this form is also published with the regulation at https://web2.gov.mb.ca/laws/regs/current/forms/071_2010/form_1e.pdf (Man. Reg. 71/2010, Schedule); confirmed with `bun run inspect` that this PDF is flattened, with no AcroForm fields, so no field map was built for it."
      ],
      "last_verified": "2026-09-26"
    },
    {
      "id": "1.1",
      "form_name": "Standard Residential Tenancy Agreement (For tenancies that include tenant services)",
      "status": "active",
      "category": "agreements",
      "matter_type": "agreement",
      "current_version": null,
      "official_url": "https://www.gov.mb.ca/cca/rtb/forms/part1to8/form1.1.doc",
      "official_index_url": "https://www.gov.mb.ca/cca/rtb/landlord/forms.html",
      "initiating_party": "landlord",
      "parties": [
        "landlord",
        "tenant"
      ],
      "property_manager_role": "May be named as contact for rent and notices; the landlord's own legal name and signature are required on the agreement itself.",
      "use_when": "Starting a residential tenancy in Manitoba where the landlord provides tenant services as defined in The Residential Tenancies Act.",
      "do_not_use_when": [
        "Tenancies that do not include tenant services (use Form 1).",
        "Tenancies of a mobile home, mobile home site, or both (use Form 2)."
      ],
      "related_forms": [
        "1",
        "2",
        "4",
        "5"
      ],
      "legal_effect": "Prescribed under The Residential Tenancies Act for tenancies with tenant services; must be printed in not less than 12-point type; includes a Tenant's Right to Cancel notice (section 7.1) giving the tenant 48 hours (excluding weekends and holidays) to cancel by written notice unless the tenant has already taken possession.",
      "source_basis": [